{
  "package_id": "research-harness",
  "package_type": "skill-pack",
  "repo": "nullius/skills-market",
  "channel": "dev",
  "version": "0.1.0",
  "summary": "Thin research project harness entry skill for nullius state recovery, routing, verification, and handoff.",
  "platforms": [
    "claude_code",
    "codex",
    "kimi_code",
    "opencode"
  ],
  "source_path": "skills/research-harness/SKILL.md",
  "depends_on": {
    "hep-mcp": ">=0.6.0 <0.7.0",
    "markdown-hygiene": ">=0.1.0 <0.2.0",
    "numerical-reliability-gate": ">=0.1.0 <0.2.0",
    "research-integrity": ">=0.1.0 <0.2.0",
    "research-team": ">=0.1.0 <0.2.0",
    "julia-package": ">=0.1.0 <0.2.0"
  },
  "install": {
    "claude_code": "Packaged install copies this skill into the target Claude Code skills root. Installed copies do not auto-follow repo updates; reinstall or rerun install with --force to refresh. For live repo-tracking development installs, use packages/skills-market/scripts/install_symlink_claude_code.sh against the monorepo skills root; that helper symlinks all market-listed skill-pack entries into the target Claude Code skills root, not only research-harness.",
    "codex": "Packaged install copies this skill into the target Codex skills root. Installed copies do not auto-follow repo updates; reinstall or rerun install with --force to refresh. For live repo-tracking development installs, use packages/skills-market/scripts/install_symlink_codex.sh against the monorepo skills root; that helper symlinks all market-listed skill-pack entries into the target Codex skills root, not only research-harness.",
    "kimi_code": "Packaged install copies this skill into the target Kimi Code skills root. Installed copies do not auto-follow repo updates; reinstall or rerun install with --force to refresh. For live repo-tracking development installs, use packages/skills-market/scripts/install_symlink_kimi_code.sh against the monorepo skills root; that helper symlinks all market-listed skill-pack entries into the target Kimi Code skills root, not only research-harness.",
    "opencode": "Packaged install copies this skill into the target OpenCode skills root. Installed copies do not auto-follow repo updates; reinstall or rerun install with --force to refresh. For live repo-tracking development installs, use packages/skills-market/scripts/install_symlink_opencode.sh against the monorepo skills root; that helper symlinks all market-listed skill-pack entries into the target OpenCode skills root, not only research-harness."
  },
  "source": {
    "repo": "nullius/skills",
    "ref": "main",
    "subpath": "skills/research-harness",
    "include": [
      "SKILL.md",
      "scripts/**",
      "references/**"
    ],
    "exclude": [
      "**/tests/**",
      "**/test/**",
      "**/tmp/**",
      "**/.pytest_cache/**",
      "**/__pycache__/**",
      "**/*.pyc",
      "**/.DS_Store"
    ]
  }
}
