{
  "package_id": "hep-calc",
  "package_type": "skill-pack",
  "repo": "nullius/skills-market",
  "channel": "dev",
  "version": "0.1.0",
  "summary": "HEP calculation reproduction/audit runner for Mathematica/Julia workflows.",
  "platforms": [
    "claude_code",
    "codex",
    "opencode"
  ],
  "source_path": "skills/hep-calc/SKILL.md",
  "runtime": {
    "python": {
      "mode": "isolated-venv",
      "packages": []
    }
  },
  "install": {
    "claude_code": "Link into ~/.claude/skills or install via marketplace when available.",
    "codex": "Link into ~/.codex/skills for Codex native discovery.",
    "opencode": "Link into ~/.config/opencode/skills for OpenCode discovery."
  },
  "source": {
    "repo": "nullius/skills",
    "ref": "main",
    "subpath": "skills/hep-calc",
    "include": [
      "SKILL.md",
      "SKILL.zh.md",
      "README.md",
      "RUNBOOK.md",
      "ROADMAP.md",
      "PROJECT_MAP.md",
      "scripts/**",
      "assets/**",
      "references/**",
      "templates/**",
      "schemas/**",
      "agents/**",
      ".gitignore"
    ],
    "exclude": [
      "**/tests/**",
      "**/test/**",
      "**/tmp/**",
      "**/.pytest_cache/**",
      "**/__pycache__/**",
      "**/*.pyc",
      "**/.DS_Store",
      "team/*",
      "team/**/*",
      "process/*",
      "process/**/*",
      ".tmp*/*",
      ".tmp*/**/*"
    ]
  }
}
