{
  "package_id": "citation-triangulation",
  "package_type": "skill-pack",
  "repo": "nullius/skills-market",
  "channel": "dev",
  "version": "0.1.0",
  "summary": "Cross-index triangulation of citation metadata: fetch the same work's canonical metadata from two or more bibliographic indexes, then run a deterministic offline comparator that emits a per-field agree/disagree/missing matrix and a fail-closed verdict (consistent / conflicted / insufficient_sources).",
  "platforms": [
    "claude_code",
    "codex",
    "opencode"
  ],
  "source_path": "skills/citation-triangulation/SKILL.md",
  "install": {
    "claude_code": "Link into ~/.claude/skills or install via marketplace when available.",
    "codex": "Link into ~/.codex/skills for Codex native discovery.",
    "opencode": "Link into ~/.config/opencode/skills for OpenCode discovery."
  },
  "source": {
    "repo": "nullius/skills",
    "ref": "main",
    "subpath": "skills/citation-triangulation",
    "include": [
      "SKILL.md",
      "agents/**",
      "scripts/**"
    ],
    "exclude": [
      "**/tests/**",
      "**/test/**",
      "**/tmp/**",
      "**/.pytest_cache/**",
      "**/__pycache__/**",
      "**/*.pyc",
      "**/.DS_Store"
    ]
  }
}
