{
  "package_id": "idea-generation",
  "package_type": "skill-pack",
  "repo": "nullius/skills-market",
  "channel": "dev",
  "version": "0.1.0",
  "summary": "Generate derived (non-seed) idea nodes for an idea campaign from research-progress evidence deltas and import them through the engine's node.import_generated RPC as an auditable generation pack. Enabled operators: LiteratureMining over a deep survey's tensions and re-anchored gaps, FailureRouting when a failed-approach ledger exists, and Mutation for parent-bearing follow-on ideas (one parent, trigger-artifact anchor, inference-typed parent-delta claim). Retrieval-first by construction (no retrieval receipt, no evidence URI), one candidate per structurally distinct anchor, mechanical dedup against every campaign node, novelty as a falsifiable closest-prior delta claim — zero generator-side scoring; nodes face the same idea-posterior admission gate as seeds.",
  "platforms": [
    "claude_code",
    "codex",
    "kimi_code",
    "opencode"
  ],
  "source_path": "skills/idea-generation/SKILL.md",
  "install": {
    "claude_code": "Link into ~/.claude/skills or install via marketplace when available.",
    "codex": "Link into ~/.codex/skills for Codex native discovery.",
    "kimi_code": "Link into ~/.kimi-code/skills for Kimi Code discovery.",
    "opencode": "Link into ~/.config/opencode/skills for OpenCode discovery."
  },
  "source": {
    "repo": "nullius/skills",
    "ref": "main",
    "subpath": "skills/idea-generation",
    "include": [
      "SKILL.md",
      "scripts/**"
    ],
    "exclude": [
      "**/tests/**",
      "**/test/**",
      "**/tmp/**",
      "**/.pytest_cache/**",
      "**/__pycache__/**",
      "**/*.pyc",
      "**/.DS_Store"
    ]
  }
}
