{
  "package_id": "numerical-reliability-gate",
  "package_type": "skill-pack",
  "repo": "nullius/skills-market",
  "channel": "dev",
  "version": "0.1.0",
  "summary": "Convergence/reliability gate for numerical results (fits, integrals, eigenvalues, roots/poles): fold only values that are stable under refinement (G1, with coarse-grid mirage detection), agreed across >=2 orthogonal methods (G2), validated by a method-agnostic invariant where available (G3, e.g. argument-principle winding over fixed-seed/threshold heuristics), regression-anchored to a known reference before any variation (G4), and degeneracy-honest (G5). Emits an auditable reliability matrix.",
  "platforms": [
    "claude_code",
    "codex",
    "opencode"
  ],
  "source_path": "skills/numerical-reliability-gate/SKILL.md",
  "install": {
    "claude_code": "Packaged install copies this skill into the target Claude Code skills root. Installed copies do not auto-follow repo updates; reinstall or rerun install with --force to refresh. For live repo-tracking development installs, use packages/skills-market/scripts/install_symlink_claude_code.sh against the monorepo skills root; that helper symlinks all market-listed skill-pack entries into the target Claude Code skills root, not only numerical-reliability-gate.",
    "codex": "Packaged install copies this skill into the target Codex skills root. Installed copies do not auto-follow repo updates; reinstall or rerun install with --force to refresh. For live repo-tracking development installs, use packages/skills-market/scripts/install_symlink_codex.sh against the monorepo skills root; that helper symlinks all market-listed skill-pack entries into the target Codex skills root, not only numerical-reliability-gate.",
    "opencode": "Packaged install copies this skill into the target OpenCode skills root. Installed copies do not auto-follow repo updates; reinstall or rerun install with --force to refresh. For live repo-tracking development installs, use packages/skills-market/scripts/install_symlink_opencode.sh against the monorepo skills root; that helper symlinks all market-listed skill-pack entries into the target OpenCode skills root, not only numerical-reliability-gate."
  },
  "source": {
    "repo": "nullius/skills",
    "ref": "main",
    "subpath": "skills/numerical-reliability-gate",
    "include": [
      "SKILL.md",
      "references/**"
    ],
    "exclude": [
      "**/tests/**",
      "**/test/**",
      "**/tmp/**",
      "**/.pytest_cache/**",
      "**/__pycache__/**",
      "**/*.pyc",
      "**/.DS_Store"
    ]
  }
}
