{
  "package_id": "hep-mcp-usage",
  "package_type": "skill-pack",
  "repo": "nullius/skills-market",
  "channel": "dev",
  "version": "0.1.0",
  "summary": "Agent-facing operating contract for using the composed hep-mcp provider stack for literature, metadata, source, and HEP evidence workflows.",
  "platforms": [
    "claude_code",
    "codex",
    "kimi_code",
    "opencode"
  ],
  "source_path": "skills/hep-mcp-usage/SKILL.md",
  "install": {
    "claude_code": "Link into ~/.claude/skills or install via marketplace when available.",
    "codex": "Link into ~/.codex/skills for Codex native discovery.",
    "kimi_code": "Link into ~/.kimi-code/skills for Kimi Code discovery.",
    "opencode": "Link into ~/.config/opencode/skills for OpenCode discovery."
  },
  "depends_on": {
    "hep-mcp": ">=0.5.0 <0.6.0"
  },
  "source": {
    "repo": "nullius/skills",
    "ref": "main",
    "subpath": "skills/hep-mcp-usage",
    "include": [
      "SKILL.md",
      "agents/**"
    ],
    "exclude": [
      "**/tests/**",
      "**/test/**",
      "**/tmp/**",
      "**/.pytest_cache/**",
      "**/__pycache__/**",
      "**/*.pyc",
      "**/.DS_Store"
    ]
  }
}
