{
  "package_id": "claude-cli-runner",
  "package_type": "skill-pack",
  "repo": "nullius/skills-market",
  "channel": "beta",
  "version": "0.1.0",
  "summary": "Non-interactive Claude CLI runner skill for file-based prompt execution.",
  "platforms": [
    "claude_code",
    "codex",
    "kimi_code",
    "opencode"
  ],
  "source_path": "skills/claude-cli-runner/SKILL.md",
  "install": {
    "claude_code": "Link into ~/.claude/skills or install via marketplace when available.",
    "codex": "Link into ~/.codex/skills for Codex native discovery.",
    "kimi_code": "Link into ~/.kimi-code/skills for Kimi Code discovery.",
    "opencode": "Link into ~/.config/opencode/skills for OpenCode discovery."
  },
  "source": {
    "repo": "nullius/skills",
    "ref": "main",
    "subpath": "skills/claude-cli-runner",
    "include": [
      "SKILL.md",
      "SKILL.zh.md",
      "README.md",
      "RUNBOOK.md",
      "ROADMAP.md",
      "PROJECT_MAP.md",
      "scripts/**",
      "assets/**",
      "references/**",
      "templates/**",
      "schemas/**",
      "agents/**",
      ".gitignore"
    ],
    "exclude": [
      "**/tests/**",
      "**/test/**",
      "**/tmp/**",
      "**/.pytest_cache/**",
      "**/__pycache__/**",
      "**/*.pyc",
      "**/.DS_Store",
      "team/*",
      "team/**/*",
      "process/*",
      "process/**/*",
      ".tmp*/*",
      ".tmp*/**/*"
    ]
  }
}
