{
  "package_id": "claim-grounding",
  "package_type": "skill-pack",
  "repo": "nullius/skills-market",
  "channel": "dev",
  "version": "0.1.0",
  "summary": "Active statement-support grounding: fetch each cited source and verify its content actually substantiates the claim, emitting a span-backed claim_grounding_report.",
  "platforms": [
    "claude_code",
    "codex",
    "kimi_code",
    "opencode"
  ],
  "source_path": "skills/claim-grounding/SKILL.md",
  "install": {
    "claude_code": "Link into ~/.claude/skills or install via marketplace when available.",
    "codex": "Link into ~/.codex/skills for Codex native discovery.",
    "kimi_code": "Link into ~/.kimi-code/skills for Kimi Code discovery.",
    "opencode": "Link into ~/.config/opencode/skills for OpenCode discovery."
  },
  "source": {
    "repo": "nullius/skills",
    "ref": "main",
    "subpath": "skills/claim-grounding",
    "include": [
      "SKILL.md",
      "SKILL.zh.md",
      "README.md",
      "RUNBOOK.md",
      "PROJECT_MAP.md",
      "scripts/**",
      "assets/**",
      "references/**",
      "templates/**",
      "schemas/**",
      "agents/**",
      ".gitignore"
    ],
    "exclude": [
      "**/tests/**",
      "**/test/**",
      "**/tmp/**",
      "**/.pytest_cache/**",
      "**/__pycache__/**",
      "**/*.pyc",
      "**/.DS_Store",
      "team/*",
      "team/**/*",
      "process/*",
      "process/**/*",
      ".tmp*/*",
      ".tmp*/**/*"
    ]
  }
}
