{
  "package_id": "deep-learning-lab",
  "package_type": "skill-pack",
  "repo": "nullius/skills-market",
  "channel": "dev",
  "version": "0.1.0",
  "summary": "Scaffold an auditable, reproducible deep-learning research project (configs, dataset provenance, artifacts/runs/<tag>/) that interoperates with research-team + research-writer.",
  "platforms": [
    "claude_code",
    "codex",
    "opencode"
  ],
  "source_path": "skills/deep-learning-lab/SKILL.md",
  "install": {
    "claude_code": "Link into ~/.claude/skills or install via marketplace when available.",
    "codex": "Link into ~/.codex/skills for Codex native discovery.",
    "opencode": "Link into ~/.config/opencode/skills for OpenCode discovery."
  },
  "source": {
    "repo": "nullius/skills",
    "ref": "main",
    "subpath": "skills/deep-learning-lab",
    "include": [
      "SKILL.md",
      "SKILL.zh.md",
      "README.md",
      "RUNBOOK.md",
      "PROJECT_MAP.md",
      "scripts/**",
      "dl_lab/**",
      "assets/**",
      "references/**",
      "templates/**",
      "schemas/**",
      "agents/**",
      ".gitignore"
    ],
    "exclude": [
      "**/tests/**",
      "**/test/**",
      "**/tmp/**",
      "**/.pytest_cache/**",
      "**/__pycache__/**",
      "**/*.pyc",
      "**/.DS_Store",
      "team/*",
      "team/**/*",
      "process/*",
      "process/**/*",
      ".tmp*/*",
      ".tmp*/**/*"
    ]
  }
}
