{
  "package_id": "derivation-verify",
  "package_type": "skill-pack",
  "repo": "nullius/skills-market",
  "channel": "dev",
  "version": "0.1.0",
  "summary": "Convergence gate for derivation-heavy results: re-derive each atomic claim >=2 independent blind ways, reconcile by mathematical equivalence, iterate to convergence, emit a verification matrix.",
  "platforms": [
    "claude_code",
    "codex",
    "kimi_code",
    "opencode"
  ],
  "source_path": "skills/derivation-verify/SKILL.md",
  "depends_on": {
    "review-swarm": ">=0.1.0 <0.2.0"
  },
  "install": {
    "claude_code": "Link into ~/.claude/skills or install via marketplace when available. Executor 1 (fast, same-model) needs the Claude Code Workflow tool; Executor 2 (cross-model CLI) reuses the review-swarm skill's run_multi_task.py and works on any host.",
    "codex": "Link into ~/.codex/skills for Codex native discovery. Executor 2 (cross-model CLI) requires the review-swarm dependency; Executor 1 (Workflow) is Claude Code only.",
    "kimi_code": "Link into ~/.kimi-code/skills for Kimi Code discovery.",
    "opencode": "Link into ~/.config/opencode/skills for OpenCode discovery. Executor 2 (cross-model CLI) requires the review-swarm dependency; Executor 1 (Workflow) is Claude Code only."
  },
  "source": {
    "repo": "nullius/skills",
    "ref": "main",
    "subpath": "skills/derivation-verify",
    "include": [
      "SKILL.md",
      "SKILL.zh.md",
      "README.md",
      "RUNBOOK.md",
      "PROJECT_MAP.md",
      "scripts/**",
      "workflows/**",
      "assets/**",
      "references/**",
      "templates/**",
      "schemas/**",
      "agents/**",
      ".gitignore"
    ],
    "exclude": [
      "**/tests/**",
      "**/test/**",
      "**/tmp/**",
      "**/.pytest_cache/**",
      "**/__pycache__/**",
      "**/*.pyc",
      "**/.DS_Store",
      "team/*",
      "team/**/*",
      "process/*",
      "process/**/*",
      ".tmp*/*",
      ".tmp*/**/*"
    ]
  }
}
